{"schema_version":"kaiba.provisioning.signing-gate-receipt-export/v1alpha2","registry_digest":"sha256:65f7f0adbcb4e54ba436a99f4a80a14bc6ae203d4bf68cbed5f12ccf4534ffaa","release_intent_digest":"sha256:f95a2fca02cacac15eb4f8037a58443816dabfc5c34cce83c0e6959981ed5af1","public_key_fingerprint":"sha256:0e68e7196fedc382ca435b995598e92d0fe36e4b1a1f949f85f5f2e6e2920fb9","receipts":[{"receipt_digest":"sha256:f132795c6e0c6ce0c771ad37be1c331c3e337528283509100486d9ba263447ed","receipt":{"schema_version":"kaiba.provisioning.signing-gate-receipt/v1alpha3","grant":{"schema_version":"kaiba.provisioning.signing-grant/v1alpha2","grant_id":"grant:6e8dcdc72ad4eec35d9a42de2254f73f6ce26d418e3b8add94d6318b4a7b1e6d:rpi5.boot_image","expires_at":"2026-09-01T14:21:42Z","request":{"schema_version":"kaiba.provisioning.signing-request/v1alpha2","request_id":"request:6e8dcdc72ad4eec35d9a42de2254f73f6ce26d418e3b8add94d6318b4a7b1e6d:rpi5.boot_image","algorithm":"rsa2048-sha256","role":"rpi5.boot_image","artifact_digest":"sha256:071b804beba56860049ac758c332d3981e4908187d9ae29865aab9e53fec1ae3","approval":{"approval_id":"approval:6e8dcdc72ad4eec35d9a42de2254f73f6ce26d418e3b8add94d6318b4a7b1e6d","approval_digest":"sha256:6e8dcdc72ad4eec35d9a42de2254f73f6ce26d418e3b8add94d6318b4a7b1e6d","release_intent_digest":"sha256:f95a2fca02cacac15eb4f8037a58443816dabfc5c34cce83c0e6959981ed5af1","role":"rpi5.boot_image","artifact_digest":"sha256:071b804beba56860049ac758c332d3981e4908187d9ae29865aab9e53fec1ae3"}}},"request_digest":"sha256:ceae9d79cafa1b79b62e725285592125d92383d79f0def08702138a3be736939","backend_id":"backend:signer:prototype","signature_hex":"124a715d8e19c0233dd2e49756408de006986e54f11dcb93a01dd8eb458dc7c5582eaed17920d2bff473cf83138ab7a92fbf63cda07746dfbef4722c7681ee88872a91f5c65bbb50fc690bc0700c46c433321bb7305c0a2504b2bf05097ee6a380f43f1c4f630acffbda9136b65491456d7c6f8715f6d669c5a06fde8f2680385903633e7c767c049b69e8e503b6575fbf508d158d9ef581a750ade819b7b22a78bcc95bb828a7781e59568411b0aed3f4046408cdeaa8ebbde01aa48a24ba7e158d2477a4c9b6df971020e99e84e5cd40c00783a13936754db35e81be1f3b2520b74a46af27c6b32e527ea46b7bb2f9b46be7acee1605db65d3a5c475b1c658","signature_digest":"sha256:c2b834997f32dc09aa9f822a76ce741b1f07fedb306c98f14b35dd1ab18a4d5f","signed_at":"2026-09-01T02:41:16Z","attestation_signature_hex":"0a9eefcf058d22cdc317f6ecebcd3f608d1a238bbb643c28590cddfafe7019fcccd5cdab7dea2df6f9d58c1aafb87cb304168077a1c05080aa44474473c1cf3f2c108c680966d0351e3b286cb2730b813cc5e52a3360ed384acc2f47165c3fcb7c41e65089709f278116252e85bc9222b8cfcad1aebd8f782c5107c2e5d77a33dc6dbfe1e7d66a628c4a4e5eab20e759f59b84115f8b6873d4faca927f8c2be04eec6e61ff084b659c680cd4376aa5c736c20a43c2f0cc61669ee52ce5a26b58dcf7b510edef2b6e5045da250c59367585769652083cddbff5186e32ffbbf5e836fc133591de44641c4875c24597cdf4cb6be3eee7240c4abaa45eb64574d3ae","attestation_signature_digest":"sha256:20afcb2a622a4f320ed0266166bf073ee735152b2044e9ddd681415c07f37789"}},{"receipt_digest":"sha256:a371a61e22f151120afa190a3c64d18f15dd95a50dd4da73b4740f4b9eaf1a51","receipt":{"schema_version":"kaiba.provisioning.signing-gate-receipt/v1alpha3","grant":{"schema_version":"kaiba.provisioning.signing-grant/v1alpha2","grant_id":"grant:6e8dcdc72ad4eec35d9a42de2254f73f6ce26d418e3b8add94d6318b4a7b1e6d:rpi5.eeprom_bootcode","expires_at":"2026-09-01T14:21:42Z","request":{"schema_version":"kaiba.provisioning.signing-request/v1alpha2","request_id":"request:6e8dcdc72ad4eec35d9a42de2254f73f6ce26d418e3b8add94d6318b4a7b1e6d:rpi5.eeprom_bootcode","algorithm":"rsa2048-sha256","role":"rpi5.eeprom_bootcode","artifact_digest":"sha256:a921f1c887fdb12b57a418404ea4656e8d0a522cec45ade28a3640c78c78c19d","approval":{"approval_id":"approval:6e8dcdc72ad4eec35d9a42de2254f73f6ce26d418e3b8add94d6318b4a7b1e6d","approval_digest":"sha256:6e8dcdc72ad4eec35d9a42de2254f73f6ce26d418e3b8add94d6318b4a7b1e6d","release_intent_digest":"sha256:f95a2fca02cacac15eb4f8037a58443816dabfc5c34cce83c0e6959981ed5af1","role":"rpi5.eeprom_bootcode","artifact_digest":"sha256:a921f1c887fdb12b57a418404ea4656e8d0a522cec45ade28a3640c78c78c19d"}}},"request_digest":"sha256:4e22b51f71c4990b47d338d8a161dedc7a5431046b70fac3ba404ad1a1422446","backend_id":"backend:signer:prototype","signature_hex":"c21d4221cd0e97bbde5336d62996f9700b081b4c4f18cf6cce53bd5f4350c9f2722fa2b4438a4685b8b31af7b2f08942c3f1366aa5d50248314c64f82cf427f5ae1b89aa62243e8d8dcae4b3f37e706137b3c1abe5bb6af8186cb24496ee8a412b7e3bfe9f1ebf2ad33b0dae0933e4c66fdeb4d0f16c380e1d7ad8658054ecbd29e48f0f84a2d88384cf1546f6c58bb5525ea5e6c0c77dace92eeb9b139d7711416bb58fb99b97d44290be7982192a5733597f76523754531f3a014d7c03a39c4e25688f66d2e174d3948b58e48718191271b9c50fec45802d7a511dcc430437617edf4f4d0738706c9ad0c9ec0b90d7f23f4fc0beb575e47115983c6c52f5e4","signature_digest":"sha256:f255b87829dd83735f2ba87133b85fc5c460197f1fcdf9755ec8c02d230ae06d","signed_at":"2026-09-01T02:42:17Z","attestation_signature_hex":"c5b906ce1995014f3425cc64aa225fbc147c9eaefd486ac984aefe24b6700afb4025e49090a47512ed81c50f852c4ccf2f529f226fc5eeacb1c9eca8091c292758e6b2cb06a0a9ef28928ab72b24c64807462d0923084462fb3f15fdca667787c65ca95ab687c808cbfecda318a749fea8036098a8b56752d11331a43c187418ea711200a61381bb102ffe9d95ddc97bd6f07c307e99a6b7976f5745321b6c2c1fd35ac5a866b83fca6d4426b4d25cdd86e23132b6cf60a2bf29ea6cf97fc6bec1bbd9ea2d843c1b2f49517da2131cf4009aacc5914e5da494a13f0c113d9353cd1cb9acfe05ad9cb93902382583a4819bc0f111df23a9afbe7f60ad20e5141a","attestation_signature_digest":"sha256:5573b6cb3a87ea21a829150d3498f9fdf21918903385ed37718849a7390e4ddd"}},{"receipt_digest":"sha256:b1e9fd7315eca8bd1cc3150fb2b228f814a141db19e78b59172a7b3abad301d1","receipt":{"schema_version":"kaiba.provisioning.signing-gate-receipt/v1alpha3","grant":{"schema_version":"kaiba.provisioning.signing-grant/v1alpha2","grant_id":"grant:6e8dcdc72ad4eec35d9a42de2254f73f6ce26d418e3b8add94d6318b4a7b1e6d:rpi5.eeprom_bootsys","expires_at":"2026-09-01T14:21:42Z","request":{"schema_version":"kaiba.provisioning.signing-request/v1alpha2","request_id":"request:6e8dcdc72ad4eec35d9a42de2254f73f6ce26d418e3b8add94d6318b4a7b1e6d:rpi5.eeprom_bootsys","algorithm":"rsa2048-sha256","role":"rpi5.eeprom_bootsys","artifact_digest":"sha256:c9d2101dbd5da8b79483e543f468df05ad841ce01b259e96eda6a03a370890e8","approval":{"approval_id":"approval:6e8dcdc72ad4eec35d9a42de2254f73f6ce26d418e3b8add94d6318b4a7b1e6d","approval_digest":"sha256:6e8dcdc72ad4eec35d9a42de2254f73f6ce26d418e3b8add94d6318b4a7b1e6d","release_intent_digest":"sha256:f95a2fca02cacac15eb4f8037a58443816dabfc5c34cce83c0e6959981ed5af1","role":"rpi5.eeprom_bootsys","artifact_digest":"sha256:c9d2101dbd5da8b79483e543f468df05ad841ce01b259e96eda6a03a370890e8"}}},"request_digest":"sha256:146b8f4eede48248e79dd398de9ed6f1bdfacd1c6e7612e2a0767aa04c8c8d93","backend_id":"backend:signer:prototype","signature_hex":"4c7b664e05f5877e2dbdd8bcbe425f8d6862a2d454471d5d62216adb0112d2c8b6762bc4916b93aec093938afa0c9db24a341273148cc8272b904488d85409aaf99c77c80f304cdd4dc7c5197b3b36ba3d77d70245abb23e409caee67e739598712bc1dfe3856d79b65a894942d38af503478f904f712f692676bc2cfb96ac36e40aebb61d50feccfaa53567fe5f4a59b9b6e140a2fbf2a77e66eae84ed320beac3282a9f037d3b5fdb1b05efe18a31d16832badfb2afb635fcc0e017c46efbe730aeff8a13c8f99e42b1aae75aa9026a2b69bc8a48e96c5a5ee9d31c68e8eb91acdff04352b2aecefef4ee7b4acf3052f1bfde4a2793c668b06b27fe8c77a2f","signature_digest":"sha256:4d5d1d9e67622c3dfadfc921b4eee3380ebb783fe8df04a1a37fc65fa9757189","signed_at":"2026-09-01T02:42:22Z","attestation_signature_hex":"b3b1d83b992dfb1b66491d47c256018cfe6844d0b665196901af98e78de4bad994528d82edb0a6e08053b601688ff09592623c0cf654c00564ebe6c19391b880a6acecc6eab99454e623b2bdfde02c80afe2f365fdedacc62354ca7b8eccadf67a662f9cd2f36fa70c8604ecb48a30b373d617d0e3ef3570e0d436067941d7d427acf7fc01d3f88a230e5fe41721f794b8358823095bf46b23632c0ebc5d6226504745cf904c958fd379ccc3e069cd56ddc0b6fe1eeb4f00a1d266880ecafdca9baa58796ca99f5d79eda0d2830e1f65fe44bc89ad73788b4f843a63d9b7fd4036e3d66657f7c650116a9a134713b3e857ced7941ea71a433959f63689619468","attestation_signature_digest":"sha256:b80f4975e53d5cd0852acdf6e5bbbc6ab09ca17e0fa62543ab7c012021602177"}},{"receipt_digest":"sha256:5462e470490ca5ff2a6049c8ff1a7e8844fae2d123b5c26c030dfa0befa02346","receipt":{"schema_version":"kaiba.provisioning.signing-gate-receipt/v1alpha3","grant":{"schema_version":"kaiba.provisioning.signing-grant/v1alpha2","grant_id":"grant:6e8dcdc72ad4eec35d9a42de2254f73f6ce26d418e3b8add94d6318b4a7b1e6d:rpi5.eeprom_config","expires_at":"2026-09-01T14:21:42Z","request":{"schema_version":"kaiba.provisioning.signing-request/v1alpha2","request_id":"request:6e8dcdc72ad4eec35d9a42de2254f73f6ce26d418e3b8add94d6318b4a7b1e6d:rpi5.eeprom_config","algorithm":"rsa2048-sha256","role":"rpi5.eeprom_config","artifact_digest":"sha256:10340da1ad369ab2604ad549556a354c2ead0578342f0710cfea93717fe18dc3","approval":{"approval_id":"approval:6e8dcdc72ad4eec35d9a42de2254f73f6ce26d418e3b8add94d6318b4a7b1e6d","approval_digest":"sha256:6e8dcdc72ad4eec35d9a42de2254f73f6ce26d418e3b8add94d6318b4a7b1e6d","release_intent_digest":"sha256:f95a2fca02cacac15eb4f8037a58443816dabfc5c34cce83c0e6959981ed5af1","role":"rpi5.eeprom_config","artifact_digest":"sha256:10340da1ad369ab2604ad549556a354c2ead0578342f0710cfea93717fe18dc3"}}},"request_digest":"sha256:4a7af2dbe32cf95c89ae7ac40e4dbdfc9966273b80664e04fd8f626f734763d8","backend_id":"backend:signer:prototype","signature_hex":"2d470ed92eff611bc0e000589bed2efea28e0060867a1ad519837ceff065cf6ee9aa13538dad3a0a442b7cb7cf19d95c1254d68168a3b9042a0ea4d99ee46b36fc30b464ad6427d2b1224be066bc21b57b006eb821d4d4915380a8177bf92b80e6429285310cff02edd72e685c0d341f0cf5b48132aab0c4515d11a843617cd9271dbd49ad6db059a55dd81857b70e7bb64178d425ccac8294c38e8adc5fa867a54ef3ee9c70030655954e5a9de111e916ef396be701fc766cd4eff9112d87d39d195bacef9425e4b68b8e39a6c329bf1b6849af1f93196c8bf216a6aa16b07a0c8bee81a630ae5556785e710347fa7ad00da3ab9af0169a84b7a083b067ce66","signature_digest":"sha256:face6d1fe7417bb360c05740f2b3f01999f97f3c98400040a2f9fc18f8bf2e70","signed_at":"2026-09-01T02:42:26Z","attestation_